{
  "schema_version": "v3",
  "lineage_id": "lineage.dolved-care-engineering.v2-to-v3-foundation",
  "lineage_version": "1",
  "parent_release": {
    "benchmark_id": "dolved-care-engineering",
    "corpus_version": "2",
    "benchmark_digest": "aabeb8c444fc5af7642d894e2f786eb684e663efe17bb702512d609a2701286d"
  },
  "target_release": {
    "benchmark_id": "dolved-care-engineering",
    "corpus_version": "3"
  },
  "taxonomy": {
    "taxonomy_id": "dolved-care-engineering-taxonomy",
    "taxonomy_version": "1",
    "taxonomy_sha256": "4f4d17654f2a510a70b640abf794ddefd1e5b84990c150f5a3dff9a7bf203af5"
  },
  "migration_tool": {
    "tool_id": "benchmark-v3-lineage",
    "tool_version": "1"
  },
  "v2_unchanged": true,
  "case_changes": [
    {
      "source_id": null,
      "target_id": "v3.complaints.compare.handling-timescales",
      "classification": "NEW",
      "reason": "Independently authored from the V3 canonical complaints source and catalogue lineage."
    },
    {
      "source_id": null,
      "target_id": "v3.complaints.compare.response-plan-incomplete",
      "classification": "NEW",
      "reason": "Independently authored from the V3 canonical complaints source and catalogue lineage."
    },
    {
      "source_id": null,
      "target_id": "v3.complaints.current.handling-deadlines",
      "classification": "NEW",
      "reason": "Independently authored from the V3 canonical complaints source and catalogue lineage."
    },
    {
      "source_id": null,
      "target_id": "v3.complaints.historical.handling-v1",
      "classification": "NEW",
      "reason": "Independently authored from the V3 canonical complaints source and catalogue lineage."
    },
    {
      "source_id": null,
      "target_id": "v3.fire.compare.drill-frequency",
      "classification": "NEW",
      "reason": "Independently authored from the V3 canonical fire-safety source and catalogue lineage."
    },
    {
      "source_id": null,
      "target_id": "v3.fire.compare.route-record-incomplete",
      "classification": "NEW",
      "reason": "Independently authored from the V3 canonical fire-safety source and catalogue lineage."
    },
    {
      "source_id": null,
      "target_id": "v3.fire.current.harbour-view-evacuation",
      "classification": "NEW",
      "reason": "Independently authored from the V3 canonical fire-safety source and catalogue lineage."
    },
    {
      "source_id": null,
      "target_id": "v3.fire.current.north-west-assembly",
      "classification": "NEW",
      "reason": "Independently authored from the V3 canonical fire-safety source and catalogue lineage."
    },
    {
      "source_id": null,
      "target_id": "v3.fire.historical.drills-v1",
      "classification": "NEW",
      "reason": "Independently authored from the V3 canonical fire-safety source and catalogue lineage."
    },
    {
      "source_id": null,
      "target_id": "v3.gdpr.current.incident-reporting",
      "classification": "NEW",
      "reason": "Independently authored from the V3 canonical gdpr source and catalogue lineage."
    },
    {
      "source_id": null,
      "target_id": "v3.gdpr.historical.data-protection-v1",
      "classification": "NEW",
      "reason": "Independently authored from the V3 canonical gdpr source and catalogue lineage."
    },
    {
      "source_id": null,
      "target_id": "v3.gdpr.insufficient.misdirected-email-deletion",
      "classification": "NEW",
      "reason": "Independently authored from the V3 canonical gdpr source and catalogue lineage."
    },
    {
      "source_id": null,
      "target_id": "v3.gdpr.valid-at-date.sar-2027",
      "classification": "NEW",
      "reason": "Independently authored from the V3 canonical gdpr source and catalogue lineage."
    },
    {
      "source_id": null,
      "target_id": "v3.health.compare.moving-handling-staffing",
      "classification": "NEW",
      "reason": "Independently authored from the V3 canonical health-safety source and catalogue lineage."
    },
    {
      "source_id": null,
      "target_id": "v3.health.current.accident-reporting",
      "classification": "NEW",
      "reason": "Independently authored from the V3 canonical health-safety source and catalogue lineage."
    },
    {
      "source_id": null,
      "target_id": "v3.health.insufficient.lone-working-police-time",
      "classification": "NEW",
      "reason": "Independently authored from the V3 canonical health-safety source and catalogue lineage."
    },
    {
      "source_id": null,
      "target_id": "v3.health.valid-at-date.accident-reporting-2024",
      "classification": "NEW",
      "reason": "Independently authored from the V3 canonical health-safety source and catalogue lineage."
    },
    {
      "source_id": null,
      "target_id": "v3.hr.current.midlands-lone-worker",
      "classification": "NEW",
      "reason": "Independently authored from the V3 canonical hr source and catalogue lineage."
    },
    {
      "source_id": null,
      "target_id": "v3.hr.current.sickness-reporting",
      "classification": "NEW",
      "reason": "Independently authored from the V3 canonical hr source and catalogue lineage."
    },
    {
      "source_id": null,
      "target_id": "v3.hr.historical.annual-leave-first",
      "classification": "NEW",
      "reason": "Independently authored from the V3 canonical hr source and catalogue lineage."
    },
    {
      "source_id": null,
      "target_id": "v3.hr.valid-at-date.annual-leave-2024",
      "classification": "NEW",
      "reason": "Independently authored from the V3 canonical hr source and catalogue lineage."
    },
    {
      "source_id": null,
      "target_id": "v3.infection-control.current.midlands-community-specimen-transport",
      "classification": "NEW",
      "reason": "Engineering regression case independently authored from a new V3 Midlands community specimen-transport source; it does not reuse calibration wording or identities."
    },
    {
      "source_id": null,
      "target_id": "v3.infection.compare.outbreak-current-v2",
      "classification": "NEW",
      "reason": "Independently authored from the V3 canonical infection-control source and catalogue lineage."
    },
    {
      "source_id": null,
      "target_id": "v3.infection.current.outbreak-no-authority",
      "classification": "NEW",
      "reason": "Independently authored from the V3 canonical infection-control source and catalogue lineage."
    },
    {
      "source_id": null,
      "target_id": "v3.infection.current.respiratory-ppe",
      "classification": "NEW",
      "reason": "Independently authored from the V3 canonical infection-control source and catalogue lineage."
    },
    {
      "source_id": null,
      "target_id": "v3.infection.historical.hand-hygiene-v1",
      "classification": "NEW",
      "reason": "Independently authored from the V3 canonical infection-control source and catalogue lineage."
    },
    {
      "source_id": null,
      "target_id": "v3.medication.compare.controlled-drugs-discrepancy",
      "classification": "NEW",
      "reason": "Engineering regression comparison authored inside the existing engineering-owned controlled-drugs lineage with independent PRIMARY and COMPARISON evidence."
    },
    {
      "source_id": null,
      "target_id": "v3.medication.current.fridge-excursion",
      "classification": "NEW",
      "reason": "Independently authored from the V3 canonical medication source and catalogue lineage."
    },
    {
      "source_id": null,
      "target_id": "v3.medication.current.omitted-dose",
      "classification": "NEW",
      "reason": "Independently authored from the V3 canonical medication source and catalogue lineage."
    },
    {
      "source_id": null,
      "target_id": "v3.medication.insufficient.fridge-quarantine-duration",
      "classification": "NEW",
      "reason": "Independently authored from the V3 canonical medication source and catalogue lineage."
    },
    {
      "source_id": "medication.controlled-drugs.valid-at-date",
      "target_id": "v3.medication.historical.controlled-drugs-v1",
      "classification": "REVISED",
      "reason": "Re-authored as an explicit attained-authority ordinal and extended with an equivalent exact-date regression variant inside the version 1 authority window."
    },
    {
      "source_id": null,
      "target_id": "v3.medication.valid-at-date.omitted-dose-2024",
      "classification": "NEW",
      "reason": "Independently authored from the V3 canonical medication source and catalogue lineage."
    },
    {
      "source_id": null,
      "target_id": "v3.payroll.compare.january-2027-incomplete",
      "classification": "NEW",
      "reason": "Independently authored from the V3 canonical payroll source and catalogue lineage."
    },
    {
      "source_id": null,
      "target_id": "v3.payroll.current.expenses",
      "classification": "NEW",
      "reason": "Independently authored from the V3 canonical payroll source and catalogue lineage."
    },
    {
      "source_id": null,
      "target_id": "v3.payroll.insufficient.receipt-attempts",
      "classification": "NEW",
      "reason": "Independently authored from the V3 canonical payroll source and catalogue lineage."
    },
    {
      "source_id": null,
      "target_id": "v3.payroll.valid-at-date.calendar-2027",
      "classification": "NEW",
      "reason": "Independently authored from the V3 canonical payroll source and catalogue lineage."
    },
    {
      "source_id": null,
      "target_id": "v3.safeguarding.compare.staff-allegation-timing",
      "classification": "NEW",
      "reason": "Independently authored from the V3 canonical safeguarding source and catalogue lineage."
    },
    {
      "source_id": null,
      "target_id": "v3.safeguarding.current.covert-medication-capacity",
      "classification": "NEW",
      "reason": "Independently authored from the V3 canonical safeguarding and medication sources and catalogue lineage."
    },
    {